COLUNA1,COLUNA2,COLUNA3,COLUNA4
Plano Nacional da Pesca Artesanal,"Agora é a vez da participação on-line! Venha construir conosco o 1º Plano Nacional da Pesca Artesanal (PNPA)!

Por meio dessa consulta pública, queremos escutar pescadoras e pescadores artesanais, pesquisadoras e pesquisadores, gestoras e gestores públicos, e grupos de apoio à pesca artesanal que não puderam participar das plenárias regionais e livres, que aconteceram entre 2024 e 2025 em todas as regiões do país.",https://brasilparticipativo.presidencia.gov.br/rails/active_storage/blobs/redirect/eyJfcmFpbHMiOnsibWVzc2FnZSI6IkJBaHBBNDRYQVE9PSIsImV4cCI6bnVsbCwicHVyIjoiYmxvYl9pZCJ9fQ==--8cebbf883652a1dd6c77481a03cb5e66b4610d79/Banner_hotsite.jpg,"['O Plano Nacional da Pesca Artesanal (PNPA) é uma iniciativa do Ministério da Pesca e Aquicultura, através da Secretaria Nacional de Pesca Artesanal (SNPA) e do Fórum Nacional da Pesca Artesanal (FNPA), instituído através da Portaria MPA Nº 269, DE 11 DE JUNHO DE 2024, E apresenta como objetivo geral estabelecer princípios, objetivos, iniciativas, estratégias, diretrizes, metas, ações e prazos que visem orientar, fundamentar e planejar as ações do Ministério da Pesca e Aquicultura (MPA) na elaboração e efetivação de políticas públicas para as pescadoras e pescadores artesanais do Brasil para os próximos 10 anos (de 2025 a 2035).', 'Os objetivos específicos do 1º. Plano Nacional da Pesca Artesanal (PNPA) são:', '1. Promover a ampliação da participação, do controle social e do apoio institucional para o planejamento e a construção democrática de políticas públicas voltadas à pesca artesanal no Brasil, respeitando as características regionais e locais e a pluralidade dos povos da pesca artesanal (jangadeiros; marisqueiras; vazanteiros; caiçaras; extrativistas; ribeirinhos; juventude pesqueira; pescadoras e pescadoras quilombolas; pescadoras e pescadoras indígenas; as demais formas tradicionais de pesca artesanal).', '2. Indicar para os governantes, em todos os níveis, e para a sociedade em geral, a importância estratégica e a necessidade de investimentos nos povos da pesca artesanal.', '3. Adotar um conjunto de princípios, objetivos e diretrizes vinculadas ao Programa Povos da Pesca Artesanal (decreto da Presidência da República n º 11.626, de 2 de agosto de 2023), bem como, a partir da elaboração do Plano Nacional da Pesca Artesanal, orientar as ações do Programa Povos da Pesca Artesanal.', '4. Incorporar as Diretrizes Voluntárias para Garantir a Pesca de Pequena Escala Sustentável no Contexto da Segurança Alimentar e da Erradicação da Pobreza, da Organização das Nações Unidas para a Alimentação e Agricultura (FAO), aprovada em 2014 e que é adotada por 143 países, inclusive o Brasil.', '5. Integrar o Estado e a sociedade na efetivação de políticas públicas que apoiem e possibilitem a promoção dos modos de vida das pescadoras pescadores artesanais, a melhoria da qualidade de vida, a defesa da justiça climática e da segurança alimentar, a valorização das práticas culturais e dos territórios pesqueiros, levando em consideração aspectos como gênero, raça/etnia e geração.;', '6. Garantir e ampliar o acesso às políticas públicas e aos direitos sociais e territoriais, assegurando o enfrentamento das situações de ameaças e/ou as diversas formas de violações que atingem às comunidades pesqueiras artesanais;', '7. Promover, apoiar, qualificar e garantir a participação das pescadoras e pescadores artesanais na formulação e no controle das políticas públicas.', 'O PNPA, além de um documento de caráter político, será, acima de tudo, uma política de gestão pública, um instrumento técnico-científico para promover a ampliação da participação, do controle social e do apoio institucional para o planejamento e a construção democrática de políticas públicas voltadas às comunidades pesqueiras artesanais, levando em consideração aspectos como gênero, raça/etnia e geração. O PNPA será, por isso, uma política de Estado.', 'Não é demais lembrar que essa é a primeira vez, na história de nosso País, que se construirá um Plano Nacional da Pesca Artesanal possibilitando, com isso, a geração de um compromisso do Estado brasileiro com os povos da pesca artesanal ao envolver, na sua elaboração, representantes das comunidades pesqueiras de todas as regiões do Brasil, pesquisadoras(es), grupos de apoio à pesca artesanal e gestores públicos. Estes últimos contribuirão, principalmente, para firmar compromissos com os objetivos, metas, prazos e diretrizes do PNPA por meio de ministérios e demais instituições do poder público, em todos os níveis federativos, ligadas aos temas de interesse da pesca artesanal.', 'O 1º. Plano Nacional da Pesca Artesanal adotará, também, um conjunto de princípios, objetivos e diretrizes vinculadas ao Programa Povos da Pesca Artesanal, bem como, a partir da sua publicação na forma de decreto, orientará as ações do Programa Povos da Pesca Artesanal daí em diante.', 'PRINCÍPIOS ORIENTADORES PARA A ELABORAÇÃO DO 1º. PLANO NACIONAL DA PESCA ARTESANAL.', 'São Princípios do 1º. Plano Nacional da Pesca Artesanal:', 'I - defesa e promoção de pescadoras e pescadores artesanais, de modo a considerar as particularidades e a diversidade sociocultural das comunidades pesqueiras artesanais;', 'II - combate ao racismo e a todas as formas de discriminação, de modo a garantir a inclusão socioeconômica da comunidade pesqueira artesanal;', 'III - respeito à pluralidade dos costumes dos povos da pesca artesanal, tais como: a) os jangadeiros; b) as marisqueiras; c) os vazanteiros; d) as caiçaras; e) os extrativistas; f) os ribeirinhos; e g) as demais formas tradicionais de pesca;', 'IV - promoção da sustentabilidade socioambiental e da preservação dos ecossistemas costeiros e marinhos, respeitados os conhecimentos tradicionais dos povos da pesca artesanal;', 'V- respeito aos modos organizativos das comunidades tradicionais pesqueiras na gestão dos recursos pesqueiros, dos territórios tradicionais e dos seus trabalhos;', 'VI - o reconhecimento das pescadoras e pescadores artesanais como sujeitos de direitos;', 'VII - a participação e o controle social;', 'VIII - a articulação das várias esferas de poder e entre governo e sociedade civil;', 'IX - a articulação, integração e intersetorialidade das políticas, programas e serviços;', 'X - a transparência da Gestão do Estado.', 'DIRETRIZES DOS EIXOS ORIENTADORES', 'As diretrizes são as grandes linhas orientadoras da política, que definem um conjunto de ações a serem realizadas em favor das pescadoras e pescadores artesanais de todas as regiões do Brasil, levando em consideração as mais distintas tradições de pesca (tipos e ambientes de pesca), estados da federação (com base na proporcionalidade do Registro Geral da Pesca – RGP), a equidade de gênero, a valorização da juventude e os aspectos étnico-raciais.', 'São Eixos Temáticos do 1º. Plano Nacional da Pesca Artesanal:']"
Novo Plano Nacional de Cultura,"O Ministério da Cultura ouviu milhares de pessoas e recebeu as suas propostas para construir o novo Plano Nacional de Cultura, que irá guiar as políticas públicas pelos próximos 10 anos.",https://brasilparticipativo.presidencia.gov.br/rails/active_storage/blobs/redirect/eyJfcmFpbHMiOnsibWVzc2FnZSI6IkJBaHBBcjZ4IiwiZXhwIjpudWxsLCJwdXIiOiJibG9iX2lkIn19--7be7865f275cd9b1c0ba8a678a9bf470560032b8/651348691-22-08-2024_mincultura_pnc_banner_1_desktop%20(2).png,"['Plano Nacional de Cultura (PNC)', 'O Plano Nacional de Cultura (PNC) é um importante instrumento que deve orientar as políticas públicas de cultura no Brasil. Ele define princípios, diretrizes, objetivos e metas e é criado com a participação da sociedade. O principal objetivo do Plano é garantir a diversidade cultural, o acesso à cultura e promover o desenvolvimento cultural do país, conforme o Art. 215 da Constituição Federal.', 'O Plano atual, aprovado em 2010 e válido até 2024, desempenhou um papel importante na promoção e preservação da cultura brasileira ao longo dos últimos anos. Porém, o cenário cultural do país mudou bastante nesse tempo, trazendo novas tendências, desafios e necessidades.', 'Por isso, é necessário criar um Novo Plano que acompanhe essas mudanças e garanta que as políticas culturais continuem atendendo às demandas da sociedade brasileira. Para saber mais sobre o Plano Nacional de Cultura, acesse: gov.br/pnc.', 'Como o Novo Plano está sendo elaborado?', 'O processo de elaboração do Novo Plano tem acontecido a partir dos seguintes processos:', 'Março - 4ª Conferência Nacional de Cultura', 'Com o tema “Democracia e Direito à Cultura”, o evento foi realizado entre 4 e 8 de março, em Brasília, após um intervalo de dez anos, reunindo cerca de 5 mil participantes de todo o Brasil. A 4ª CNC foi o pontapé para a construção do Novo Plano Nacional de Cultura, uma vez que as propostas, as rodas de conversas e as consultas realizadas na Conferência serviram como base para a elaboração da proposta inicial de Plano.', 'Maio e Junho - Oficinas com a Escola Nacional de Administração Pública', 'O Ministério da Cultura realizou 17 oficinas em parceria com a Escola Nacional de Administração Pública (Enap). Além de membros do MinC, também participaram representantes de outros órgãos do governo federal e da sociedade civil. O objetivo foi construir uma proposta base de princípios, diretrizes, objetivos e sugestões de metas para o Novo Plano Nacional de Cultura.', 'Outubro/24 a janeiro/25 - Processo de participação social do Novo Plano Nacional de Cultura', 'Realização de uma série de consultas, tanto presenciais quanto virtuais, para ouvir a sociedade civil de forma ampla e acessível. A meta é sistematizar as contribuições e chegar à proposta final do Novo Plano Nacional de Cultura, que deve ser encaminhada ao Congresso Nacional.', 'Como foi o processo de participação do Novo Plano Nacional de Cultura?', 'Participação', 'A elaboração do Novo Plano foi feitar a partir de  um processo aberto e participativo. Todos os cidadãos puderam contribuir com suas ideias e sugestões através de:', 'O que foram as enquetes?', 'As enquetes são um modo simples de participar em que as pessoas podiam concordar ou discordar com frases dos principais temas do novo Plano Nacional de Cultura.', 'O que o Ministério da Cultura vai fazer com os resultados das enquetes?', 'Com isso, o Ministério da Cultura busca saber quais são os temas de maior mobilização e concordância. Esses dados serão organizados e, com base neles, serão reunidas sugestões de abordagem e de conteúdos para o Novo Plano Nacional de Cultura.Você poderá conferir os resultados desse processo aqui na página do Brasil Participativo, onde será publicada a devolutiva da participação em breve.Importante:esse é um processo participativo de escuta e não uma pesquisa quantitativa de opinião. Queremos olhar para os resultados e reflexões de opinião no geral.O que foram as sugestões de metas?Qualquer pessoa poderia sugeriro que o Plano Nacional de Cultura deve realizar até 2035.Essas propostas serão trabalhadas comometaspara o Novo Plano Nacional de Cultura.Como as propostas foram analisadas?As 5 propostas mais votadas de cada eixo foram analisadas e poderão ser incorporadas no Novo Plano Nacional de Cultura. Os(as) proponentes das 2 mais votadas de cada eixo serão convidados(as) para uma reunião online com a equipe do Ministério da Cultura para apresentar suas ideias.Com base nessas respostas, o MinC e o Comitê-Executivo do Plano irão fazer propostas de metas para o Novo Plano Nacional de Cultura e ajustar os demais conteúdos estratégicos, caso necessário.', 'Com isso, o Ministério da Cultura busca saber quais são os temas de maior mobilização e concordância. Esses dados serão organizados e, com base neles, serão reunidas sugestões de abordagem e de conteúdos para o Novo Plano Nacional de Cultura.', 'Você poderá conferir os resultados desse processo aqui na página do Brasil Participativo, onde será publicada a devolutiva da participação em breve.', 'Importante:esse é um processo participativo de escuta e não uma pesquisa quantitativa de opinião. Queremos olhar para os resultados e reflexões de opinião no geral.', 'O que foram as sugestões de metas?', 'Qualquer pessoa poderia sugeriro que o Plano Nacional de Cultura deve realizar até 2035.Essas propostas serão trabalhadas comometaspara o Novo Plano Nacional de Cultura.', 'Como as propostas foram analisadas?', 'As 5 propostas mais votadas de cada eixo foram analisadas e poderão ser incorporadas no Novo Plano Nacional de Cultura. Os(as) proponentes das 2 mais votadas de cada eixo serão convidados(as) para uma reunião online com a equipe do Ministério da Cultura para apresentar suas ideias.', 'Com base nessas respostas, o MinC e o Comitê-Executivo do Plano irão fazer propostas de metas para o Novo Plano Nacional de Cultura e ajustar os demais conteúdos estratégicos, caso necessário.', 'O que foram as oficinas?', 'As oficinas territoriais foram espaços participativos colaborativos para colaboração nos principais conteúdos co-construir os objetivos e metas do Plano Nacional de Cultura, garantindo que as especificidades dos territórios sejam consideradas. Essas oficinas buscaram qualificar a proposta- base do Plano, assegurando a inclusão de todas as diversidades, como raça, gênero, etnia, classe e acessibilidade, em ambientes adequados para a participação equitativa de todos. Foram trabalhados os diagnósticos de cada território, assim como os objetivos e resultados para o Novo Plano.', 'O que foram as sugestões na proposta-base', 'Aqui no Brasil Participativo, as pessoas sugeriram melhorias na primeira versão do texto de princípios, diretrizes, transversalidades e objetivos de cada eixo do novo Plano.', 'O Ministério irá analisar as contribuições feitas nessa seção para incorporação no novo Plano. A devolutiva dessas sugestões será feita no Brasil Participativo no próximo ano.', 'O que foi feito com as contribuições?', 'Análise das contribuições', 'Todas as propostas das oficinas e as 5 mais votadas em cada eixo na Plataforma serão analisadas pelo Ministério da Cultura e demais responsáveis para verificar a possibilidade de incorporar ou não.', 'Os proponentes das 2 propostas mais votadas por eixo serão convidados para um encontro virtual com a equipe do Ministério da Cultura para apresentar e discutir as propostas.', 'As respostas da enquete e das contribuições no texto base serão tratadas em conjunto e servirão de insumo para o plano.', 'O Ministério da Cultura fará uma devolutiva desse processo em 2025 e publicará na página do Brasil Participativo.', 'Como eu posso acompanhar mais desse processo e ter mais informações do Plano?', 'Acompanhamento', 'Você pode acompanhar pela página do Plano Nacional de Cultura emgov.br/pnce nas redes sociais do Ministério:']"
Plano Nacional de Educação em Direitos Humanos (PNEDH),Sem descrição,https://brasilparticipativo.presidencia.gov.br/rails/active_storage/blobs/redirect/eyJfcmFpbHMiOnsibWVzc2FnZSI6IkJBaHBBcGF2IiwiZXhwIjpudWxsLCJwdXIiOiJibG9iX2lkIn19--002b9795b4d4b09781aea5d8d862089ec1a1027f/banner_desktop_PNEDH_1480x220.png,"['Sobre a revisão do PNEDH', 'OPlano Nacional de Educação em Direitos Humanos (PNEDH)é uma política pública brasileira que visa promover uma cultura de/em direitos humanos, por meio daEducação em Direitos Humanos (EDH). Tendo sua base sido elaborada, inicialmente, em 2003, pelo então recém-instaladoComitê Nacional de Educação em Direitos Humanos (CNEDH), e, em 2006, sua versão definitiva publicada; o plano é fruto direto da colaboração entre a Secretaria Especial de Direitos Humanos (SEDH/PR), o Ministério da Educação (MEC), o Ministério da Justiça (MJ) e a Sociedade Civil - essa última participando do seu processo de elaboração por meio de audiências públicas, realizadas a partir de Encontros Estaduais de Educação em Direitos Humanos, nas diversas Universidades Federais brasileiras.', 'O PNEDH conceitua aEDHcomo ""[...] umprocessosistemático e multidimensional, que orienta a formação do sujeito de direitos, articulando as seguintes dimensões:', 'a) a apreensão de conhecimentos historicamente construídos sobre direitos humanos e a sua relação com os contextos internacional, nacional e local;', 'b) afirmação de valores, atitudes e práticas sociais que expressem a cultura dos direitos humanos em todos os espaços da sociedade;', 'c) formação de uma consciência cidadã capaz de se fazer presente em níveis cognitivo, social, ético e político;', 'd) desenvolvimento de processos metodológicos participativos e de construção coletiva, utilizando linguagens e materiais didáticos contextualizados;', 'e) fortalecimento de práticas individuais e sociais que gerem ações e instrumentos em favor da promoção, da proteção e da defesa dos direitos humanos, bem como da reparação das violações"" (BRASIL, 2009, p. 25, grifo nosso).', 'Ainda, visa promover a EDH por meio de5 grandes eixos de atuação:', 'Educação BásicaEducação SuperiorEducação Não-FormalEducação dos Profissionais dos Sistemas de Justiça e Segurança PúblicaeEducação e Mídia', 'Por fim, a efetividade de sua implementação reside na necessidade de se construir uma sociedade que valorize a solidariedade e o respeito às diversidades, partindo da educação como ferramenta fundamental para o desenvolvimento de uma consciência cidadã. Sendo, portanto, a EDH essencial para o enfrentamento dos desafios sociais atuais e para a promoção de uma cultura de paz, de democracia e de justiça social.\u200b', 'Elaborado com significativa participação da Sociedade Civil, envolvendo uma construção colaborativa que buscou incorporar diversas perspectivas e conhecimentos, o processo de fundação do PNEDH 1 começou em 2003 com a formação do CNEDH, responsável por coordenar as atividades e promover amplas discussões com a população entre os anos de 2004 e 2005 sobre o tema. Promovendo, assim, múltiplas consultas públicas e debates à época, que envolveram diferentes segmentos da sociedade, incluindo Organizações Não Governamentais, Movimentos Sociais e instituições acadêmicas e de pesquisa.', 'Nesse sentido, a participação da Sociedade Civil foi essencial para a sua legitimidade e abrangência. Suas organizações contribuíram ativamente com propostas e críticas ao documento, enriquecendo-o com uma diversidade de pontos de vista e de experiências práticas e fazendo com que esse engajamento coletivo garantisse que o plano refletisse necessidades e aspirações da sociedade brasileira, da maneira mais completa e inclusiva possível.', 'Durante suas etapas de elaboração, os seminários, os encontros regionais e as consultas públicas realizadas permitiram a participação direta dos cidadãos/ãs. Promovendo debates sobre os seus princípios, objetivos e diretrizes, além de possibilitar a troca de experiências e de boas práticas entre diferentes atores. Sendo o resultado final desse processo a versão do PNEDH 1, publicada em 2006.', 'Incorporando metodologias participativas e de construção coletiva e incentivando o uso de linguagens e materiais didáticos contextualizados, a estrutura do PNEDH também buscou reforçar a participação ativa da sociedade em seu monitoramento e avaliação. E é nesse mesmo contexto que será trabalhada a nova construção do PNEDH 2, garantindo sua eficácia e adaptabilidade às mudanças sociais a partir da renovação de seu processo participativo, tanto presencial como digital.']"
O que é a Estratégia Brasil 2050?,"A Estratégia Brasil 2050 é um instrumento de planejamento estratégico de longo prazo para criar soluções aos desafios do presente, pensando nos impactos no futuro. Ela orientará o desenvolvimento do país até 2050, envolvendo governo, empresas, universidades e sociedade civil.",https://brasilparticipativo.presidencia.gov.br/rails/active_storage/blobs/redirect/eyJfcmFpbHMiOnsibWVzc2FnZSI6IkJBaHBBOGdYQVE9PSIsImV4cCI6bnVsbCwicHVyIjoiYmxvYl9pZCJ9fQ==--a007567a64e8861745d78812ee80be56a958cb8e/antiga%20br%202050.png,"['A Estratégia Brasil 2050 é um instrumento de planejamento estratégico de longo prazo para criar soluções aos desafios do presente, pensando nos impactos no futuro. Ela orientará o desenvolvimento do país até 2050, envolvendo governo, empresas, universidades e sociedade civil.', 'Quais são os objetivos da Estratégia Brasil 2050?', 'Reduzir desigualdades sociais e regionais⠀⠀', 'Enfrentar as mudanças climáticas⠀⠀⠀⠀⠀⠀⠀⠀', 'Preparar o país para a transição demográfica⠀⠀', 'Promover o aumento dos investimentos e⠀⠀ garantir crescimento econômico', 'Promover sustentabilidade macroeconômica', 'Como a Estratégia Brasil 2050 será construída?', 'O processo de elaboração da Estratégia Brasil 2050 envolve as seguintes atividades:', 'Análise situacional e retrospectiva', 'Elaboração e análise de estudos temáticos e prospectivos', 'Análise de estratégias ou planos nacionais, regionais e setoriais', 'Definição e fundamentação de megatendências e incertezas críticas', 'Elaboração do cenário desejado para 2050', 'Formulação dos atributos da Estratégia Brasil 2050: visão de futuro, valores, diretrizes, eixos, desafios, orientações, indicadores-chave nacionais e metas', 'Consolidação da Estratégia Brasil 2050', 'Quem participa da Construção da Estratégia Brasil 2050?', 'A Estratégia Brasil 2050 se propõe a ser o referencial estratégico do país, capaz de mobilizar parcerias institucionais e recursos para orientar o desenvolvimento nacional até 2050.⠀\n⠀\n⠀⠀⠀⠀\n\n\n⠀\n⠀\n⠀\n⠀\n⠀\n⠀\n⠀\n⠀\n⠀\n⠀\n⠀\n⠀\n⠀\n⠀\n⠀\n⠀\n⠀\n\n⠀\n⠀\n⠀\n⠀\n⠀\n⠀\n⠀\n⠀⠀\n⠀\n\n⠀\n⠀\n⠀\n⠀\n⠀\n⠀\n ⠀\n\n⠀\n\n⠀\n⠀\n⠀\n⠀\n⠀\n⠀\nA Secretaria Nacional de Planejamento (SEPLAN) coordena o processo, mas a construção é colaborativa, incluindo: Governo federal, estadual e municipal; Setor privado e empresas; Universidades e pesquisadores; Parlamento e Judiciário; Conselhos; Órgãos de Controle; Organismos Multilaterais; e Sociedade Civil.']"
