COLUNA1,COLUNA2,COLUNA3,COLUNA4
A Ciência no Enfrentamento ao Desastre de 2024 no RS: da Emergência à Reconstrução,"Com o tema ""A Ciência no Enfrentamento ao Desastre de 2024 no RS: da emergência à reconstrução"", este seminário surge como uma resposta ao impacto severo do desastre climático que atingiu o Rio Grande do Sul em abril e maio de 2024. A força das águas deixou 95 municípios gaúchos em calamidade e 365 em emergência (460 de 497 municípios), com danos extensos na infraestrutura e nas paisagens urbana e rural, vidas e histórias perdidas em inundações, enxurradas, deslizamentos e rupturas recordes no relevo. Houve a necessidade de apoio emergencial e de reconstrução inéditos para as cidades e o campo, pois centenas de milhares de pessoas e empresas foram atingidas. Desde então, tornaram-se necessárias políticas públicas e ações da sociedade de adaptação, de mitigação e de preparação para futuros eventos extremos.",https://brasilparticipativo.presidencia.gov.br/rails/active_storage/blobs/redirect/eyJfcmFpbHMiOnsibWVzc2FnZSI6IkJBaHBBZ1RIIiwiZXhwIjpudWxsLCJwdXIiOiJibG9iX2lkIn19--b1aa287d6c6f0bc95a60e002e10391db64bc3d9e/testeira-hotsite-1480x220.png,"['O Rio Grande do Sul enfrentou um dos maiores desastres climáticos de sua história no final de abril e início de maio de 2024. O evento resultou na inundação de uma área superior a 5 mil km², com 95 municípios declarados em estado de calamidade e outros 323 em situação de emergência, representando 84% dos municípios do estado, conforme Decreto Estadual 57.646, de 30 de maio de 2024. Ao todo, 2,398 milhões de pessoas foram afetadas, sendo 862,6 mil diretamente impactadas, incluindo 321,1 mil inscritas no CadÚnico. Foram registradas 182 mortes e 31 pessoas permanecem desaparecidas.', 'Quase 100 mil empresas foram atingidas, incluindo 47 mil MEIs, afetando 1 milhão e 200 mil empregos. O desastre também danificou 704 escolas, 213 unidades de saúde, 102 bibliotecas e museus, e 667 unidades de segurança. Na zona rural, mais de 206 mil propriedades sofreram prejuízos, com 19,19 mil estabelecimentos afetados de forma severa. As perdas resultaram de inundações, enxurradas, deslizamentos e rupturas na terra, com mais de 31 mil movimentos de massa mapeados, sendo que a erosão impactou 2,7 milhões de hectares de solo fértil.', 'A colheita de 2,71 milhões de toneladas de soja foi perdida, afetando 15,2 mil produtores. Além disso, 7,8 mil produtores de leite, 8,3 mil fruticultores, 8,05 mil olericultores, 2,85 mil pescadores artesanais, e mais de 80% das comunidades quilombolas e indígenas sofreram impactos. Na reforma agrária, foram 7.437 lotes afetados, com 244 famílias desalojadas, destruição de cerca de 3 mil km de estradas, centenas de casas e barragens, além de prejuízos às lavouras de arroz orgânico em assentamentos na região metropolitana.', 'O Governo Federal já mobilizou R$ 100,4 bilhões para ações emergenciais e de reconstrução, sendo R$ 82,3 bilhões de recursos novos e R$ 17,5 bilhões em antecipações. Além disso, estão sendo repassados R$ 23 bilhões até 2027 para o Fundo de Reconstrução do Rio Grande (FUNRIGS) e R$ 8,84 bilhões para obras de proteção contra enchentes e saneamento (Novo PAC). O desastre reitera a necessidade de aprofundar o debate sobre medidas de mitigação, regeneração de ecossistemas, e ações de adaptação e prevenção. O Brasil deve apresentar avanços no tema na 30ª Conferência das Nações Unidas sobre Mudanças Climáticas (COP 30), em 2025.', 'A Secretaria para Apoio à Reconstrução, em parceria com instituições de pesquisa e entidades federais, promove um Seminário para analisar e avaliar o desastre com gestores públicos do Rio Grande do Sul e, neste diálogo, buscar articulações entre ciência e política para enfrentar eventos climáticos extremos.', 'Eixos Temáticos do evento', 'Com a proposta de realizar uma análise multidimensional do desastre, das mudanças climáticas, das vulnerabilidades e riscos e promover sugestões para o enfrentamento e a reconstrução sustentável do Rio Grande do Sul, o seminário “A Ciência no Enfrentamento ao Desastre de 2024 no RS: da emergência à reconstrução” organizou sua programação a partir dos seguintes eixos temáticos:', '●\xa0\xa0\xa0\xa0\xa0\xa0\xa0Dimensão meteorológica e mudanças climáticas', '●\xa0\xa0\xa0\xa0\xa0\xa0\xa0Dimensão hidrológica', '●\xa0\xa0\xa0\xa0\xa0\xa0\xa0Dimensão geológica e geossistêmica (geologia, geomorfologia)', '●\xa0\xa0\xa0\xa0\xa0\xa0\xa0Dimensão da biodiversidade e serviços ecossistêmicos (vegetação, fauna, ecologia)', '●\xa0\xa0\xa0\xa0\xa0\xa0\xa0Impactos na agropecuária e nas cadeias alimentares', '●\xa0\xa0\xa0\xa0\xa0\xa0\xa0Impactos econômicos, no emprego, no trabalho, na renda e na infraestrutura produtiva', '●\xa0\xa0\xa0\xa0\xa0\xa0\xa0Impactos na vida urbana, uso e ocupação do solo e habitação', '●\xa0\xa0\xa0\xa0\xa0\xa0\xa0Impactos na infraestrutura, no setor público e serviços de energia, transporte, saneamento, comunicação', '●\xa0\xa0\xa0\xa0\xa0\xa0\xa0Impactos junto aos povos e comunidades tradicionais', '●\xa0\xa0\xa0\xa0\xa0\xa0\xa0Impactos nas condições de saúde, bem-estar psicossocial e socorro a animais', '●\xa0\xa0\xa0\xa0\xa0\xa0\xa0Educação, comunicação e uso de tecnologias para redução de vulnerabilidades e gestão de riscos', '●\xa0\xa0\xa0\xa0\xa0\xa0\xa0Governança, gestão territorial e políticas públicas para redução das vulnerabilidades e gestão de riscos de desastres', 'Organização do evento', 'Comissão organizadora', 'Comissão científica', 'Para mais informações acesse nossoInstagram']"
Brasil Unido pelo Rio Grande do Sul,Sem descrição,https://brasilparticipativo.presidencia.gov.br/rails/active_storage/blobs/redirect/eyJfcmFpbHMiOnsibWVzc2FnZSI6IkJBaHBBaDJoIiwiZXhwIjpudWxsLCJwdXIiOiJibG9iX2lkIn19--a7243c2a411c78d25dce51030a6a14870fc7b02d/Banner-GERAL-4---1480x220.png,"['Ações do Governo Federal em Números', 'R$ 112 bi', 'investimento total do governo federal', 'R$ 23 bi', 'suspensão da divida do estado', '32 mil', 'toneladas de doações transportadas pelo governo federal', 'Canais oficiais de emergência', 'Ligue 100', 'direitos humanos', 'ligue 180', 'Central de atendimento à mulher', 'ligue 191', 'Policia Rodoviaria Federal', 'Ligue 193', 'Bombeiros RS', 'Disque 190', 'Polícia Militar']"
Plano Clima Participativo,Sem descrição,https://brasilparticipativo.presidencia.gov.br/rails/active_storage/blobs/redirect/eyJfcmFpbHMiOnsibWVzc2FnZSI6IkJBaHBBbGl2IiwiZXhwIjpudWxsLCJwdXIiOiJibG9iX2lkIn19--d253ea33361717a1625ef74b3a39a21d8e98a1ec/Banner_Plano_Clima_Participativo_DESKTOP_(1480-px-720-px)%20(1).png,"['Sobre o Plano Clima', 'Com a emergência climática, eventos extremos como a pior seca em 70 anos no Pantanal e as fortes chuvas que atingiram o Rio Grande do Sul em maio e junho de 2024 ficarão cada vez mais intensos e frequentes.', 'Conter o aquecimento global, responsável pelas alterações dos padrões climáticos do planeta, é uma tarefa de todos os países. O esforço brasileiro será expresso no Plano Clima, que também apresentará medidas para reduzir as emissões e aumentar as remoções de GEE do Brasil e prevenir e lidar com danos causados pela mudança do clima.(clique aqui para saber mais)', 'A elaboração doPlano Climaé conduzida, desde o final de 2023, peloComitê Interministerial sobre Mudança do Clima (CIM), integrado por representantes de 23 ministérios, pela Rede Clima e pelo Fórum Brasileiro de Mudança do Clima. Seu processo de construção conta com ampla participação da sociedade em espaços presenciais e digitais, como o Plano Clima Participativo.', 'O plano, que servirá como guia da política climática brasileira até 2035, terá dois pilares. O primeiro é a Estratégia Nacional de Mitigação, para reduzir as emissões líquidas de gases de efeito estufa, cuja alta concentração na atmosfera provoca o aquecimento global. O segundo é a Estratégia Nacional de Adaptação, para diminuir a vulnerabilidade de cidades, setores, populações e ambientes naturais à mudança do clima e garantir melhores condições de o país enfrentar os eventos climáticos extremos. Os componentes de mitigação e adaptação também terão planos setoriais e temáticos.', 'Esse conjunto de ações leva em conta, ainda, uma estratégia mais ampla de ação climática, que lida com a necessidade de uma transição justa em termos socioambientais, além de impactos econômicos e ambientais, meios de implementação, educação, ciência, tecnologia e inovação, e monitoramento, avaliação e transparência.', 'OPlano Climase insere no contexto da meta brasileira sob o Acordo de Paris – a Contribuição Nacionalmente Determinada, ou NDC, na sigla em inglês –, no âmbito da Convenção-Quadro das Nações Unidas sobre Mudança do Clima.', 'A nova NDC do Brasil, apresentada na COP 29 no Azerbaijão, determina o compromisso de reduzir as emissões líquidas de gases-estufa no país entre 67% e 59% até 2035, em comparação aos níveis de 2005 — o que equivale a alcançar entre 850 milhões e 1,05 bilhão de toneladas de CO₂ equivalente, respectivamente, e emissões líquidas zero até 2050. Isso significa atingir um equilíbrio entre as emissões e as remoções desses gases da atmosfera, por meio, por exemplo, do papel desempenhado pela manutenção e recuperação da vegetação nativa na captura e estoque de carbono.', 'No final de 2023, o primeiro balanço global do Acordo de Paris mostrou que o mundo está fora da rota para conter o aquecimento médio do planeta a 1,5ºC, limite estabelecido pela ciência e pactuado nas negociações entre os países para evitar danos ainda maiores. O Brasil, juntamente com Emirados Árabes Unidos e Azerbaijão, lidera a chamada ""Missão 1,5"", para que as metas climáticas para 2035 sejam mais ambiciosas e efetivas.', 'Mitigação', 'A mitigação — ou a redução das emissões líquidas de gases de efeito estufa — é o principal caminho apontado pela ciência para frear o avanço das mudanças climáticas e impedir que elas acarretem em impactos ainda mais dramáticos.', 'Diferentemente da maior parte dos países, as emissões brasileiras não são protagonizadas pela queima de combustíveis fósseis, mas pelo desmatamento. Em seguida, vêm as emissões da agropecuária, lideradas pela fermentação entérica, produzida pelo processo digestivo do gado. Em terceiro lugar, aparece o setor de energia, com a queima de combustíveis fósseis nos transportes, nas cidades e nas indústrias.', 'As emissões líquidas brasileiras já caíram em relação ao que foi registrado em 2005, principalmente por conta da diminuição do desmatamento até 2018, quando voltou a subir.', 'Dados mais recentes mostram uma nova queda do desmatamento na Amazônia a partir de 2023, da ordem de 50%, segundo dados de alertas do Instituto Nacional de Pesquisas Espaciais (INPE), resultado da retomada de medidas de fiscalização. A redução do desmatamento e a recuperação de vegetação nativa representam a principal oportunidade para o Brasil caminhar na direção de emissões líquidas zero em 2050. Mas mesmo a meta já lançada oficialmente de desmatamento zero em 2030 não é suficiente para cumprirmos nossos compromissos na agenda global do clima.', 'Outros setores, como agropecuária e energia, aumentaram suas emissões no período. Em ordem decrescente, os aumentos relativos do nível de emissão observados entre 2005 e 2022 foram de 38% em Resíduos, 31% em Energia, 23% em IPPU e 20% em Agropecuária. Por outro lado, o descolamento entre as taxas de crescimento da atividade e o de emissões já pode ser observado em diversas cadeias produtivas e atividades econômicas, indicando caminhos para descarbonização.', 'Dessa maneira, oPlano Climabusca identificar as melhores alternativas em termos de custos e efetividade para o país cortar emissões. Todos os setores econômicos precisam adotar medidas de mitigação para reduzir suas emissões líquidas ou acelerar o “descolamento” entre atividade econômica e as emissões setoriais de GEE por meio da redução significativa da intensidade de emissões. Os debates levam em conta ações como o fomento a práticas agropecuárias de baixo carbono, a expansão de fontes renováveis na matriz energética,o aumento da eficiência energética, o desenvolvimento urbano integrado e sustentável, o desenvolvimento de novas tecnologias de captura, uso e armazenamento de carbono, especialmente auqelas associadas à bioenergia, a oferta de hidrogênio de baixo carbono, até a coleta seletiva de lixo e o aproveitamento energético dos resíduos sólidos, entre outras.', 'O compromisso nacional de redução de emissões será alocado entre os diferentes setores econômicos, tanto para o horizonte de 2030, como para 2035. A Estratégia Nacional de Mitigação será acompanhada por sete planos setoriais com definição de ações, indicadores, metas, meios de implementação, com benefícios e impactos adversos e seus respectivos sistemas de monitoramento e avaliação (veja o quadro abaixo).', 'Adaptação', 'Adaptação à mudança do clima é o processo de ajuste dos sistemas naturais e humanos ao clima presente e futuro, de forma a evitar danos potenciais e explorar oportunidades. A adaptação tem, portanto, papel fundamental na redução da exposição e da vulnerabilidade à mudança do clima.', 'Já a plataformaAdaptaBrasil, do Ministério da Ciência, Tecnologia e Inovação (MCTI), identificou pouco mais da metade dos 5.570 municípios brasileiros com índice de vulnerabilidade alto ou muito alto a desastres geo-hidrológicos, como enchentes, inundações e deslizamentos de terra, conforme mostra o mapa abaixo. Ainda de acordo com a plataforma, 48% dos municípios do país (2.263) têm capacidade baixa ou muito baixa diante de eventos de secas.', 'Reduzir a vulnerabilidade aos impactos da mudança do clima é o principal objetivo doPlano Climana área de adaptação, com diretrizes setoriais e temáticas e orientações para os estados e municípios. Ele está sendo elaborado a partir de oficinas, o que garante ampla participação social. A Estratégia Nacional de Adaptação incluirá 16 planos setoriais e temáticos, que contam com planos de ação, custos e meios de implementação para períodos de quatro anos (veja o quadro abaixo).', 'O governo brasileiro se compromete em sua Contribuição Nacionalmente Determinada (NDC, em inglês) a reduzir as emissões líquidas de gases-estufa no país de 59% a 67% até 2035, em comparação aos níveis de 2005. Assim, o Brasil se compromete com metas graduais mais robustas de redução de emissões com vistas a alcançar a emissão líquida zero em 2050.', 'Perguntas frequentes', 'O que é o Plano Clima?', 'O Plano Nacional sobre Mudança do Clima (Plano Clima) será o guia da política climática brasileira até 2035. Sua nova versão, a ser apresentada em 2025, está em elaboração no governo, com ampla participação da sociedade, e definirá ações para que o Brasil reduza suas emissões de gases de efeito estufa e se adapte aos impactos da mudança do clima, que já ocorrem e irão se intensificar ano a ano. É um instrumento previsto na Política Nacional sobre Mudança do Clima (PNMC), também em atualização neste momento. Uma primeira versão do Plano Clima foi lançada em 2008, possui metas para o ano de 2020, e pode seracessada aqui.', 'Qual o horizonte temporal do novo Plano Clima?', 'O documento terá um planejamento de médio prazo até 2035, com ajustes e revisões previstos a cada dois anos.', 'Quais documentos irão compor o novo Plano Clima?', 'O novo Plano Nacional sobre Mudança do Clima será composto por:', 'transição justaimpactos socioeconômicos e ambientais da transiçãomeios de implementação e financiamentoeducação, pesquisa, desenvolvimento, inovação, ciência e tecnologiamonitoramento, gestão, avaliação e transparência', 'agricultura e pecuáriauso e cobertura do solo em áreas públicascidadesenergiaindústriaresíduostransportes', 'agricultura e pecuáriaagricultura familiarbiodiversidadecidadesredução e gestão de riscos e de desastresindústria e mineraçãoenergiatransportesigualdade racial e combate ao racismopovos e comunidades tradicionaispovos indígenasrecursos hídricossaúdesegurança alimentar e nutricionaloceano e zona costeiraturismo', 'Quais os compromissos assumidos pelo Brasil na agenda global do clima?', 'Os compromissos mais recentes estão mencionados na atual Contribuição Nacionalmente Determinada (NDC 3.0) do Brasil à Convenção-Quadro das Nações Unidas sobre Mudança do Clima (UNFCCC),disponível aqui:', 'Para comparação, os últimos dados disponíveis mostram que as emissões brasileiras foram de 2,039 bilhões de tCO2e em 2022, conforme o último Inventário Nacional de Emissões e Remoções de Gases de Efeito Estufa, disponível no Sistema de Registro Nacional de Emissões (SIRENE).', 'Quais órgãos exercem a governança em mudança do clima no governo brasileiro?', 'A governança climática no Brasil, a nível federal, é exercida pelo Comitê Interministerial sobre Mudança do Clima (CIM), estabelecido peloDecreto nº 11.550, de 5 de junho de 2023.', 'O Comitê é presidido pela Casa Civil da Presidência da República e integrado por representantes de 23 ministérios. Também participam do CIM representantes da Rede Clima e do Fórum Brasileiro de Mudança do Clima, sem direito a voto. A secretaria executiva é exercida pela Secretaria Nacional de Mudança do Clima do Ministério do Meio Ambiente e Mudança do Clima (MMA).', 'A agenda climática é prioridade no governo federal: mais de 15 órgãos do Executivo têm áreas dedicadas a ela. Em janeiro de 2023, o nome do MMA recebeu o termo ""mudança do clima"" para expressar a centralidade do tema.', 'Por que mitigar emissões e se adaptar às mudanças climáticas?', 'O caminho apontado pela ciência para lidar com o aquecimento global envolve a necessidade de cortar drasticamente as emissões de Gases de Efeito Estufa (GEE) e promover a adaptação aos efeitos já notáveis da mudança do clima, que tendem a atingir mais as populações mais vulneráveis. Os efeitos da mudança do clima previstos pela ciência incluem, por exemplo, desastres como enchentes, inundações e deslizamentos de terra, secas severas e ondas de calor, e alcançam condições de saúde, segurança alimentar e energética e toda a infraestrutura de transportes.', 'Cada país tem o seu compromisso de corte das emissões de GEE. O Brasil irá alocar os compromissos entre os setores que mais emitem, considerando as melhores opções em termos de custo e efetividade.', 'Relatórios do IPCC (Painel Intergovernamental sobre Mudanças Climáticas, na sigla em inglês, vinculado à Organização das Nações Unidas, a ONU) traduzidos para o português podem ser lidosaqui.', 'Desde o início dos anos 1990, o IPCC publica relatórios com cenários sobre o aquecimento global.O mais recente relatório (AR-6), o sexto já publicado, mostrou a urgência necessária na adoção de medidas para conter o aquecimento global, diante do aumento das emissões.', 'Qual é o nível das emissões brasileiras de gases de efeito estufa e quais os principais setores responsáveis por elas?', 'Os últimos dados disponíveis mostram que as emissões brasileiras foram de 2,039 bilhões de tCO2e em 2022, conforme o último Inventário Nacional de Emissões e Remoções de Gases de Efeito Estufa, disponível noSistema de Registro Nacional de Emissões (SIRENE).', 'O Brasil tem um perfil peculiar de emissões, liderado pelo desmatamento, que se inclui no setor de mudança do uso da terra. A segunda maior fonte de emissões no Brasil é a agropecuária, tanto pelo uso de fertilizantes nitrogenados como, sobretudo, pelo processo digestivo do gado, chamado de fermentação entérica. Em terceiro lugar, aparecem as emissões do setor de energia, liderada principalmente pela queima de combustíveis fósseis em diferentes setores econômicos e pelas emissões associadas às indústrias de energia. Processos industriais e o setor de resíduos também emitem gases de efeito estufa, ainda que em menor proporção.', 'Quais os impactos e riscos relacionados à mudança do clima?', 'A mudança do clima impõe diversos riscos à vida no planeta. Seus impactos, já notáveis em ondas de calor, enchentes históricas, como as que devastam o Rio Grande do Sul, e secas extremas, como as vividas na Amazônia no final de 2023, tendem a se tornar cada vez mais intensos e frequentes.', 'As transformações do clima comprometem a saúde da população e a produção de alimentos (segurança alimentar) e de e energia, já que boa parte da energia elétrica consumida no Brasil é gerada por hidrelétricas, afetadas por eventos climáticos como as secas. Também representam riscos à infraestrutura de transportes, como observado recentemente no Rio Grande do Sul. Populações em áreas de risco, vulneráveis a inundações e deslizamentos de terras, devem ser priorizadas nas estratégias de adaptação. Mas todos os setores da economia serão atingidos, de alguma forma.']"
Plano Plurianual - PPA,"O Plano Plurianual (PPA) é o principal instrumento de planejamento orçamentário de médio prazo do Governo Federal. Ele define as diretrizes, os objetivos e as metas da administração pública federal, contemplando as despesas de capital (como, por exemplo, os investimentos) e outras delas decorrentes, além daquelas relativas aos programas de duração continuada. O PPA é estabelecido por lei, com vigência de quatro anos. Ele se inicia no segundo ano de mandato de um presidente e se prolonga até o final do primeiro ano do mandato de seu sucessor.

A partir da elaboração do PPA, o Poder Executivo propõe o projeto de lei do Plano Plurianual Federal ao Congresso Nacional até quatro meses antes do encerramento do primeiro ano de mandato do presidente. O novo Plano é então avaliado e votado pelos congressistas e, posteriormente, sancionado pelo Presidente da República. O PPA é o instrumento responsável por nortear  anualmente a elaboração da Lei de Diretrizes Orçamentárias (LDO) e a Lei Orçamentária Anual (LOA).",https://brasilparticipativo.presidencia.gov.br/rails/active_storage/blobs/redirect/eyJfcmFpbHMiOnsibWVzc2FnZSI6IkJBaHBBaTd2IiwiZXhwIjpudWxsLCJwdXIiOiJibG9iX2lkIn19--bf5fa6bbe73f087c2af8a11e9b667b39807a5b86/Banner-Plano-Plurianual-PPA-Participativo.png,"['O PPA Participativo foi o método de construção da proposta do Plano Plurianual (PPA) 2024-2027, por meio do qual o governo federal envolveu população brasileira, organizações, redes, movimentos sociais, conselhos e entidades representativas em um amplo esforço de participação social, de escuta e de diálogo com a população sobre o futuro do nosso país.', 'Este PPA 2024-2027, que é um marco simbólico da reconstrução da capacidade de planejamento do Estado brasileiro, foi elaborado de forma integrada com todos os ministérios e com intensa participação social. A partir do planejamento, será possível transformar em realidade as propostas do Plano de Governo e as expectativas da sociedade, para melhorar a vida de milhões de brasileiras e brasileiros.', 'Os ministérios tiveram a responsabilidade de analisar os conteúdos. Em seguida, o Ministério do Planejamento e Orçamento (MPO) elaborou um documento dedevolutivacontendo o que foi incorporado e a justificativa do que não foi incorporado.']"
